<?xml version="1.0" encoding="UTF-8"?>
<!ELEMENT biblioteca (canciones)>
<!ELEMENT canciones (cancion+)>
<!ELEMENT cancion (titulo, artista, genero)>
<!ELEMENT titulo (#PCDATA)>
<!ELEMENT artista (#PCDATA)>
<!ELEMENT genero (#PCDATA)>